src_host,dst_host,Comment,Expires,_added_by,_added_at,_review_status
EDITED_AFTER_LAZY_INIT,SRV-FILE01,Approved file share access,,,,
SECOND_EDIT,Station_2,Test comment for DR88,,admin,2026-02-18T17:17:08Z,pending
SRV-SCAN01,DC01,Vulnerability scanner authenticated scans,2026-04-30 12:00,admin,,
SRV-SCAN01,DC02,Vulnerability scanner authenticated scans,2026-04-30 12:00,admin,,
SRV-ANSIBLE01,SRV-APP01,Ansible configuration management,,,,
SRV-ANSIBLE01,SRV-APP02,Ansible configuration management,,,,
